question,answer,contexts,ground_truth,user_input,retrieved_contexts,response,reference,faithfulness,answer_relevancy,context_precision,context_recall
What caused oil prices to increase in the first half of the year?,"Oil prices increased in the first half of the year due to concerns about escalation of the conflict in the Middle East, additional costs of rerouting some oil shipping away from the Red Sea, and ongoing production cuts by OPEC and its allies.","['6 PAR T 1: R ECENT E CONOMIC AND F INANCIAL D E v ELOPMENTS (figure 3, left panel). Oil prices increased, on net, in the first half of this year (figure 4). Prices rose amid concerns about escalation of the conflict in the Middle East, additional costs of rerouting some oil shipping away from the Red Sea, and ongoing production cuts by OPEC (Organization of the Petroleum Exporting Countries) and its allies. Continuing geopolitical tensions, including tensions emanating from the conflicts in the Middle East and Ukraine, pose an upside risk to energy prices. Prices of agricultural commodities and livestock edged up, on net, over the first half of this year after having come down markedly in 2022 and 2023 from the highs reached at the start of Russia’s war on Ukraine in early 2022 (figure 5). As a result of these movements, the 12-month change in PCE food prices slowed substantially from'
 '2017 Food and energy Percent change from year earlier Energy + – + – 2 + _0 2 4 6 8 Percent change from year earlier 20242023202220212020201920182017 Components of core prices Monthly Housing services NOTE: The data are monthly. SOURCE: Bureau of Economic Analysis via Haver Analytics. 3. Subcomponents of personal consumption expenditures price inde xes Brent spot price 20 40 60 80 100 120 140 Dollars per barrel 2019 2020 2021 2022 2023 2024 4. Spot and futures prices for crude oil Weekly 24-month-ahead futures contracts NOTE: The data are weekly averages of daily data and extend through June 28, 2024. SOURCE: ICE Brent Futures via Bloomberg. Agriculture and livestock 80 100 120 140 160 180 200 Week ending January 4, 2019 = 100 2019 2020 2021 2022 2023 2024 5. Spot prices for commodities Weekly Industrial metals NOTE: The data are weekly averages of daily data and extend through June 28,'
 'quarter of this year and then eased somewhat in April and May. As a result, the 12-month change in core PCE prices declined from the 4.7 percent pace in May of last year to 2.9 percent in December and moved down further this year, to 2.6 percent in May (figure 2). A similar message is evident from the trimmed mean measure of PCE prices constructed by the Federal Reserve Bank of Dallas, which provides an alternative approach to reducing the influence of idiosyncratic price movements. The index increased 2.8 percent over the 12 months ending in May, a pace that is somewhat slower than at the end of last year (as shown in figure 1). Consumer energy prices have increased, while food price inflation has flattened out PCE energy prices increased 4.8 percent in the 12 months ending in May after having declined 12.3 percent over the preceding 12 months Part 1 recent economic and financiaL'
 'early 2022 (figure 5). As a result of these movements, the 12-month change in PCE food prices slowed substantially from its peak of 12.2 percent in August 2022 to just 1.2 percent in May (as shown in figure 3, left panel). Prices of both energy and food products are of particular importance for lower-income households, for which such necessities account for a large share of expenditures. Reflecting the sharp increases seen in 2021 and 2022, these price indexes are 25 percent and 32 percent higher than in 2019, for food and energy, respectively. Food and beverages Services ex. energy and housing Goods ex. food, beverages, and energy20 10 0 10 20 30 40 50 60 70 4 2 0 2 4 6 8 10 12 14 Percent change from year earlier 2024 2023 2022 20212020 2019 2018 2017 Food and energy Percent change from year earlier Energy + – + – 2 + _0 2 4 6 8 Percent change from year earlier']","Oil prices increased due to Middle East conflict risks, higher shipping costs from rerouting away from the Red Sea, and ongoing OPEC production cuts.",What caused oil prices to increase in the first half of the year?,"['6 PAR T 1: R ECENT E CONOMIC AND F INANCIAL D E v ELOPMENTS (figure 3, left panel). Oil prices increased, on net, in the first half of this year (figure 4). Prices rose amid concerns about escalation of the conflict in the Middle East, additional costs of rerouting some oil shipping away from the Red Sea, and ongoing production cuts by OPEC (Organization of the Petroleum Exporting Countries) and its allies. Continuing geopolitical tensions, including tensions emanating from the conflicts in the Middle East and Ukraine, pose an upside risk to energy prices. Prices of agricultural commodities and livestock edged up, on net, over the first half of this year after having come down markedly in 2022 and 2023 from the highs reached at the start of Russia’s war on Ukraine in early 2022 (figure 5). As a result of these movements, the 12-month change in PCE food prices slowed substantially from', '2017 Food and energy Percent change from year earlier Energy + – + – 2 + _0 2 4 6 8 Percent change from year earlier 20242023202220212020201920182017 Components of core prices Monthly Housing services NOTE: The data are monthly. SOURCE: Bureau of Economic Analysis via Haver Analytics. 3. Subcomponents of personal consumption expenditures price inde xes Brent spot price 20 40 60 80 100 120 140 Dollars per barrel 2019 2020 2021 2022 2023 2024 4. Spot and futures prices for crude oil Weekly 24-month-ahead futures contracts NOTE: The data are weekly averages of daily data and extend through June 28, 2024. SOURCE: ICE Brent Futures via Bloomberg. Agriculture and livestock 80 100 120 140 160 180 200 Week ending January 4, 2019 = 100 2019 2020 2021 2022 2023 2024 5. Spot prices for commodities Weekly Industrial metals NOTE: The data are weekly averages of daily data and extend through June 28,', 'quarter of this year and then eased somewhat in April and May. As a result, the 12-month change in core PCE prices declined from the 4.7 percent pace in May of last year to 2.9 percent in December and moved down further this year, to 2.6 percent in May (figure 2). A similar message is evident from the trimmed mean measure of PCE prices constructed by the Federal Reserve Bank of Dallas, which provides an alternative approach to reducing the influence of idiosyncratic price movements. The index increased 2.8 percent over the 12 months ending in May, a pace that is somewhat slower than at the end of last year (as shown in figure 1). Consumer energy prices have increased, while food price inflation has flattened out PCE energy prices increased 4.8 percent in the 12 months ending in May after having declined 12.3 percent over the preceding 12 months Part 1 recent economic and financiaL', 'early 2022 (figure 5). As a result of these movements, the 12-month change in PCE food prices slowed substantially from its peak of 12.2 percent in August 2022 to just 1.2 percent in May (as shown in figure 3, left panel). Prices of both energy and food products are of particular importance for lower-income households, for which such necessities account for a large share of expenditures. Reflecting the sharp increases seen in 2021 and 2022, these price indexes are 25 percent and 32 percent higher than in 2019, for food and energy, respectively. Food and beverages Services ex. energy and housing Goods ex. food, beverages, and energy20 10 0 10 20 30 40 50 60 70 4 2 0 2 4 6 8 10 12 14 Percent change from year earlier 2024 2023 2022 20212020 2019 2018 2017 Food and energy Percent change from year earlier Energy + – + – 2 + _0 2 4 6 8 Percent change from year earlier']","Oil prices increased in the first half of the year due to concerns about escalation of the conflict in the Middle East, additional costs of rerouting some oil shipping away from the Red Sea, and ongoing production cuts by OPEC and its allies.","Oil prices increased due to Middle East conflict risks, higher shipping costs from rerouting away from the Red Sea, and ongoing OPEC production cuts.",0.25,0.9954037631462045,0.9999999999,1.0
How did the 12-month change in PCE food prices evolve from 2022 to May 2024?,The 12-month change in PCE food prices slowed substantially from its peak of 12.2 percent in August 2022 to just 1.2 percent in May 2024.,"['early 2022 (figure 5). As a result of these movements, the 12-month change in PCE food prices slowed substantially from its peak of 12.2 percent in August 2022 to just 1.2 percent in May (as shown in figure 3, left panel). Prices of both energy and food products are of particular importance for lower-income households, for which such necessities account for a large share of expenditures. Reflecting the sharp increases seen in 2021 and 2022, these price indexes are 25 percent and 32 percent higher than in 2019, for food and energy, respectively. Food and beverages Services ex. energy and housing Goods ex. food, beverages, and energy20 10 0 10 20 30 40 50 60 70 4 2 0 2 4 6 8 10 12 14 Percent change from year earlier 2024 2023 2022 20212020 2019 2018 2017 Food and energy Percent change from year earlier Energy + – + – 2 + _0 2 4 6 8 Percent change from year earlier'
 'quarter of this year and then eased somewhat in April and May. As a result, the 12-month change in core PCE prices declined from the 4.7 percent pace in May of last year to 2.9 percent in December and moved down further this year, to 2.6 percent in May (figure 2). A similar message is evident from the trimmed mean measure of PCE prices constructed by the Federal Reserve Bank of Dallas, which provides an alternative approach to reducing the influence of idiosyncratic price movements. The index increased 2.8 percent over the 12 months ending in May, a pace that is somewhat slower than at the end of last year (as shown in figure 1). Consumer energy prices have increased, while food price inflation has flattened out PCE energy prices increased 4.8 percent in the 12 months ending in May after having declined 12.3 percent over the preceding 12 months Part 1 recent economic and financiaL'
 '5 Domestic Developments Inflation eased notably last year and has shown modest further progress in recent months Inflation stepped down markedly last year and has shown modest further progress so far this year. Inflation remains elevated, though, and is still above the Federal Open Market Committee’s (FOMC) longer-run objective of 2 percent. The price index for personal consumption expenditures (PCE) rose 2.6 percent over the 12 months ending in May, down from the 4.0 percent pace a year ago but little changed since the end of last year (figure 1). After having slowed markedly in the second half of 2023, monthly core PCE price inflation—which excludes food and energy prices and is generally considered a better guide to the direction of future inflation— firmed in the first quarter of this year and then eased somewhat in April and May. As a result, the 12-month change in core PCE prices'
 '6 PAR T 1: R ECENT E CONOMIC AND F INANCIAL D E v ELOPMENTS (figure 3, left panel). Oil prices increased, on net, in the first half of this year (figure 4). Prices rose amid concerns about escalation of the conflict in the Middle East, additional costs of rerouting some oil shipping away from the Red Sea, and ongoing production cuts by OPEC (Organization of the Petroleum Exporting Countries) and its allies. Continuing geopolitical tensions, including tensions emanating from the conflicts in the Middle East and Ukraine, pose an upside risk to energy prices. Prices of agricultural commodities and livestock edged up, on net, over the first half of this year after having come down markedly in 2022 and 2023 from the highs reached at the start of Russia’s war on Ukraine in early 2022 (figure 5). As a result of these movements, the 12-month change in PCE food prices slowed substantially from']",The 12-month change in PCE food prices slowed from a peak of 12.2 percent in August 2022 to 1.2 percent in May 2024.,How did the 12-month change in PCE food prices evolve from 2022 to May 2024?,"['early 2022 (figure 5). As a result of these movements, the 12-month change in PCE food prices slowed substantially from its peak of 12.2 percent in August 2022 to just 1.2 percent in May (as shown in figure 3, left panel). Prices of both energy and food products are of particular importance for lower-income households, for which such necessities account for a large share of expenditures. Reflecting the sharp increases seen in 2021 and 2022, these price indexes are 25 percent and 32 percent higher than in 2019, for food and energy, respectively. Food and beverages Services ex. energy and housing Goods ex. food, beverages, and energy20 10 0 10 20 30 40 50 60 70 4 2 0 2 4 6 8 10 12 14 Percent change from year earlier 2024 2023 2022 20212020 2019 2018 2017 Food and energy Percent change from year earlier Energy + – + – 2 + _0 2 4 6 8 Percent change from year earlier', 'quarter of this year and then eased somewhat in April and May. As a result, the 12-month change in core PCE prices declined from the 4.7 percent pace in May of last year to 2.9 percent in December and moved down further this year, to 2.6 percent in May (figure 2). A similar message is evident from the trimmed mean measure of PCE prices constructed by the Federal Reserve Bank of Dallas, which provides an alternative approach to reducing the influence of idiosyncratic price movements. The index increased 2.8 percent over the 12 months ending in May, a pace that is somewhat slower than at the end of last year (as shown in figure 1). Consumer energy prices have increased, while food price inflation has flattened out PCE energy prices increased 4.8 percent in the 12 months ending in May after having declined 12.3 percent over the preceding 12 months Part 1 recent economic and financiaL', '5 Domestic Developments Inflation eased notably last year and has shown modest further progress in recent months Inflation stepped down markedly last year and has shown modest further progress so far this year. Inflation remains elevated, though, and is still above the Federal Open Market Committee’s (FOMC) longer-run objective of 2 percent. The price index for personal consumption expenditures (PCE) rose 2.6 percent over the 12 months ending in May, down from the 4.0 percent pace a year ago but little changed since the end of last year (figure 1). After having slowed markedly in the second half of 2023, monthly core PCE price inflation—which excludes food and energy prices and is generally considered a better guide to the direction of future inflation— firmed in the first quarter of this year and then eased somewhat in April and May. As a result, the 12-month change in core PCE prices', '6 PAR T 1: R ECENT E CONOMIC AND F INANCIAL D E v ELOPMENTS (figure 3, left panel). Oil prices increased, on net, in the first half of this year (figure 4). Prices rose amid concerns about escalation of the conflict in the Middle East, additional costs of rerouting some oil shipping away from the Red Sea, and ongoing production cuts by OPEC (Organization of the Petroleum Exporting Countries) and its allies. Continuing geopolitical tensions, including tensions emanating from the conflicts in the Middle East and Ukraine, pose an upside risk to energy prices. Prices of agricultural commodities and livestock edged up, on net, over the first half of this year after having come down markedly in 2022 and 2023 from the highs reached at the start of Russia’s war on Ukraine in early 2022 (figure 5). As a result of these movements, the 12-month change in PCE food prices slowed substantially from']",The 12-month change in PCE food prices slowed substantially from its peak of 12.2 percent in August 2022 to just 1.2 percent in May 2024.,The 12-month change in PCE food prices slowed from a peak of 12.2 percent in August 2022 to 1.2 percent in May 2024.,0.5,0.9526804267123777,0.7499999999625,1.0
What are the three components used to assess core price inflation?,"The three components used to assess core price inflation are core goods, core housing services, and core nonhousing services.","['8 PAR T 1: R ECENT E CONOMIC AND F INANCIAL D E v ELOPMENTS year ahead. (The box “Housing Services Inflation and Market Rent Measures” provides further details.) . . . while core nonhousing services price inflation flattened out so far this year Finally, price inflation for core nonhousing services—a broad group that includes services such as travel and dining, financial services, and car repair—slowed last year but flattened out, on net, in the first five months of this year. Core nonhousing services prices rose 3.4 percent in the 12 months ending in May, down from 4.7 percent a year ago but little changed since the end of last year (as shown in figure 3, right panel). The lack of further progress this year is due in large part to price increases in volatile categories—for example, portfolio management services, which can be influenced by idiosyncratic factors, such as swings in the'
 '5 Domestic Developments Inflation eased notably last year and has shown modest further progress in recent months Inflation stepped down markedly last year and has shown modest further progress so far this year. Inflation remains elevated, though, and is still above the Federal Open Market Committee’s (FOMC) longer-run objective of 2 percent. The price index for personal consumption expenditures (PCE) rose 2.6 percent over the 12 months ending in May, down from the 4.0 percent pace a year ago but little changed since the end of last year (figure 1). After having slowed markedly in the second half of 2023, monthly core PCE price inflation—which excludes food and energy prices and is generally considered a better guide to the direction of future inflation— firmed in the first quarter of this year and then eased somewhat in April and May. As a result, the 12-month change in core PCE prices'
 'the Philippines, Russia, Saudi Arabia, Singapore, South Korea, Taiwan, Thailand, and Vietnam, weighted by shares of U.S. non-oil goods imports, and begins in 2017:Q2. The inflation measure is the Harmonised Index of Consumer Prices for the euro area and the consumer price index for other economies. The data show percent changes from year-ago levels. SOURCE: Federal Reserve Board staff calculations; Haver Analytics. Energy Food Core 1 + _0 1 2 3 4 5 6 7 8 9 Percent 2017–19avg. 2020–21avg. 2022 2023:H12 023:H2 2024:Q1 Emerging market economies Energy Food Core 42. Components of foreign consumer price inflation'
 '6). Smoothing through these monthly movements, prices for core goods over the 12 months ending in May moved down 1.1 percent, similar to their pre-pandemic rate of decline, after having increased 2.5 percent over the previous 12-month period (figure 3, right panel). The progress on inflation for core goods reflects improvements in supply– demand imbalances. Indeed, the supply chain issues and other capacity constraints that had earlier boosted inflation so much continued to ease, though at a more gradual pace this year than over the past two years, and supply– demand conditions in goods markets appear to be relatively balanced. For example, the shares of respondents to the Quarterly Survey of Plant Capacity Utilization citing insufficient supply of labor or materials as reasons for producing below capacity, which had increased considerably during the pandemic, have continued to fall and']","Core goods, housing services, and core nonhousing services.",What are the three components used to assess core price inflation?,"['8 PAR T 1: R ECENT E CONOMIC AND F INANCIAL D E v ELOPMENTS year ahead. (The box “Housing Services Inflation and Market Rent Measures” provides further details.) . . . while core nonhousing services price inflation flattened out so far this year Finally, price inflation for core nonhousing services—a broad group that includes services such as travel and dining, financial services, and car repair—slowed last year but flattened out, on net, in the first five months of this year. Core nonhousing services prices rose 3.4 percent in the 12 months ending in May, down from 4.7 percent a year ago but little changed since the end of last year (as shown in figure 3, right panel). The lack of further progress this year is due in large part to price increases in volatile categories—for example, portfolio management services, which can be influenced by idiosyncratic factors, such as swings in the', '5 Domestic Developments Inflation eased notably last year and has shown modest further progress in recent months Inflation stepped down markedly last year and has shown modest further progress so far this year. Inflation remains elevated, though, and is still above the Federal Open Market Committee’s (FOMC) longer-run objective of 2 percent. The price index for personal consumption expenditures (PCE) rose 2.6 percent over the 12 months ending in May, down from the 4.0 percent pace a year ago but little changed since the end of last year (figure 1). After having slowed markedly in the second half of 2023, monthly core PCE price inflation—which excludes food and energy prices and is generally considered a better guide to the direction of future inflation— firmed in the first quarter of this year and then eased somewhat in April and May. As a result, the 12-month change in core PCE prices', 'the Philippines, Russia, Saudi Arabia, Singapore, South Korea, Taiwan, Thailand, and Vietnam, weighted by shares of U.S. non-oil goods imports, and begins in 2017:Q2. The inflation measure is the Harmonised Index of Consumer Prices for the euro area and the consumer price index for other economies. The data show percent changes from year-ago levels. SOURCE: Federal Reserve Board staff calculations; Haver Analytics. Energy Food Core 1 + _0 1 2 3 4 5 6 7 8 9 Percent 2017–19avg. 2020–21avg. 2022 2023:H12 023:H2 2024:Q1 Emerging market economies Energy Food Core 42. Components of foreign consumer price inflation', '6). Smoothing through these monthly movements, prices for core goods over the 12 months ending in May moved down 1.1 percent, similar to their pre-pandemic rate of decline, after having increased 2.5 percent over the previous 12-month period (figure 3, right panel). The progress on inflation for core goods reflects improvements in supply– demand imbalances. Indeed, the supply chain issues and other capacity constraints that had earlier boosted inflation so much continued to ease, though at a more gradual pace this year than over the past two years, and supply– demand conditions in goods markets appear to be relatively balanced. For example, the shares of respondents to the Quarterly Survey of Plant Capacity Utilization citing insufficient supply of labor or materials as reasons for producing below capacity, which had increased considerably during the pandemic, have continued to fall and']","The three components used to assess core price inflation are core goods, core housing services, and core nonhousing services.","Core goods, housing services, and core nonhousing services.",0.3333333333333333,0.9811846462461492,0.0,1.0
Why did core goods prices increase modestly in early 2024?,"Core goods prices increased modestly in early 2024 likely due, in part, to movements in nonfuel import prices, which turned up in recent months after having declined, on net, over 2023.","['MONETARy POLIC y REPORT: JULy 2024 7 4 2 + _0 2 4 6 8 Percent change from year earlier 202420222020201820162014 6. Nonfuel import price index Monthly SOURCE: Bureau of Labor Statistics via Haver Analytics. Core goods prices increased modestly this year after having declined sharply in the second half of 2023 In assessing the outlook for inflation, it is helpful to consider three separate components of core prices: core goods, housing services, and core nonhousing services. After posting notable declines in the second half of last year, core goods prices increased modestly, on net, over the first months of this year. This development likely reflects, in part, movements in nonfuel import prices, which turned up in recent months after having declined, on net, over 2023 (figure 6). Smoothing through these monthly movements, prices for core goods over the 12 months ending in May moved down'
 '6). Smoothing through these monthly movements, prices for core goods over the 12 months ending in May moved down 1.1 percent, similar to their pre-pandemic rate of decline, after having increased 2.5 percent over the previous 12-month period (figure 3, right panel). The progress on inflation for core goods reflects improvements in supply– demand imbalances. Indeed, the supply chain issues and other capacity constraints that had earlier boosted inflation so much continued to ease, though at a more gradual pace this year than over the past two years, and supply– demand conditions in goods markets appear to be relatively balanced. For example, the shares of respondents to the Quarterly Survey of Plant Capacity Utilization citing insufficient supply of labor or materials as reasons for producing below capacity, which had increased considerably during the pandemic, have continued to fall and'
 '8 PAR T 1: R ECENT E CONOMIC AND F INANCIAL D E v ELOPMENTS year ahead. (The box “Housing Services Inflation and Market Rent Measures” provides further details.) . . . while core nonhousing services price inflation flattened out so far this year Finally, price inflation for core nonhousing services—a broad group that includes services such as travel and dining, financial services, and car repair—slowed last year but flattened out, on net, in the first five months of this year. Core nonhousing services prices rose 3.4 percent in the 12 months ending in May, down from 4.7 percent a year ago but little changed since the end of last year (as shown in figure 3, right panel). The lack of further progress this year is due in large part to price increases in volatile categories—for example, portfolio management services, which can be influenced by idiosyncratic factors, such as swings in the'
 '5 Domestic Developments Inflation eased notably last year and has shown modest further progress in recent months Inflation stepped down markedly last year and has shown modest further progress so far this year. Inflation remains elevated, though, and is still above the Federal Open Market Committee’s (FOMC) longer-run objective of 2 percent. The price index for personal consumption expenditures (PCE) rose 2.6 percent over the 12 months ending in May, down from the 4.0 percent pace a year ago but little changed since the end of last year (figure 1). After having slowed markedly in the second half of 2023, monthly core PCE price inflation—which excludes food and energy prices and is generally considered a better guide to the direction of future inflation— firmed in the first quarter of this year and then eased somewhat in April and May. As a result, the 12-month change in core PCE prices']",Because nonfuel import prices increased and supply–demand imbalances continued to ease.,Why did core goods prices increase modestly in early 2024?,"['MONETARy POLIC y REPORT: JULy 2024 7 4 2 + _0 2 4 6 8 Percent change from year earlier 202420222020201820162014 6. Nonfuel import price index Monthly SOURCE: Bureau of Labor Statistics via Haver Analytics. Core goods prices increased modestly this year after having declined sharply in the second half of 2023 In assessing the outlook for inflation, it is helpful to consider three separate components of core prices: core goods, housing services, and core nonhousing services. After posting notable declines in the second half of last year, core goods prices increased modestly, on net, over the first months of this year. This development likely reflects, in part, movements in nonfuel import prices, which turned up in recent months after having declined, on net, over 2023 (figure 6). Smoothing through these monthly movements, prices for core goods over the 12 months ending in May moved down', '6). Smoothing through these monthly movements, prices for core goods over the 12 months ending in May moved down 1.1 percent, similar to their pre-pandemic rate of decline, after having increased 2.5 percent over the previous 12-month period (figure 3, right panel). The progress on inflation for core goods reflects improvements in supply– demand imbalances. Indeed, the supply chain issues and other capacity constraints that had earlier boosted inflation so much continued to ease, though at a more gradual pace this year than over the past two years, and supply– demand conditions in goods markets appear to be relatively balanced. For example, the shares of respondents to the Quarterly Survey of Plant Capacity Utilization citing insufficient supply of labor or materials as reasons for producing below capacity, which had increased considerably during the pandemic, have continued to fall and', '8 PAR T 1: R ECENT E CONOMIC AND F INANCIAL D E v ELOPMENTS year ahead. (The box “Housing Services Inflation and Market Rent Measures” provides further details.) . . . while core nonhousing services price inflation flattened out so far this year Finally, price inflation for core nonhousing services—a broad group that includes services such as travel and dining, financial services, and car repair—slowed last year but flattened out, on net, in the first five months of this year. Core nonhousing services prices rose 3.4 percent in the 12 months ending in May, down from 4.7 percent a year ago but little changed since the end of last year (as shown in figure 3, right panel). The lack of further progress this year is due in large part to price increases in volatile categories—for example, portfolio management services, which can be influenced by idiosyncratic factors, such as swings in the', '5 Domestic Developments Inflation eased notably last year and has shown modest further progress in recent months Inflation stepped down markedly last year and has shown modest further progress so far this year. Inflation remains elevated, though, and is still above the Federal Open Market Committee’s (FOMC) longer-run objective of 2 percent. The price index for personal consumption expenditures (PCE) rose 2.6 percent over the 12 months ending in May, down from the 4.0 percent pace a year ago but little changed since the end of last year (figure 1). After having slowed markedly in the second half of 2023, monthly core PCE price inflation—which excludes food and energy prices and is generally considered a better guide to the direction of future inflation— firmed in the first quarter of this year and then eased somewhat in April and May. As a result, the 12-month change in core PCE prices']","Core goods prices increased modestly in early 2024 likely due, in part, to movements in nonfuel import prices, which turned up in recent months after having declined, on net, over 2023.",Because nonfuel import prices increased and supply–demand imbalances continued to ease.,1.0,0.9687876039331053,0.99999999995,1.0
How has housing services inflation changed since May 2023?,"Housing services price inflation has slowed gradually since May 2023, with the 12-month change in housing services prices moving down from more than 8 percent in May 2023 to 5.5 percent in May of this year, though it remains well above its pre-pandemic level.","['reasons for producing below capacity, which had increased considerably during the pandemic, have continued to fall and are now near pre- pandemic levels (figure 7). Housing services price inflation continued to slow gradually but remains elevated . . . The 12-month change in housing services prices moved down from more than 8 percent in May 2023 to 5.5 percent in May of this year but is still well above its pre-pandemic level (as shown in figure 3, right panel). Market rent inflation, which measures increases in rents for new housing leases to new tenants, has fallen markedly since late 2022 to near pre-pandemic rates, and this slowdown points to continued easing of housing services inflation over the Insufficient supply of labor 0 10 20 30 40 50 Percent 202420232022202120202019 7. Reasons for operating below full capacity Quarterly Insufficient supply of materials NOTE: The series are'
 'regarding the timing of this decline and whether market rent infl ation will, in fact, remain moderate . 8 . Between January 2020 and April 2024, the CoreLogic Single-Family Rent Index and the Zillow Observed Rent Index have increased 32 percent and 38 percent, respectively, while PCE prices for housing services have increased 23 percent . See Christopher D . Cotton (2024), “A Faster Convergence of Shelter Prices and Market Rent: Implications for Infl ation,” Current Policy Perspectives 2024-4 (Boston: Federal Reserve Bank of Boston, June), https://www .bostonfed .org/-/media/ Documents/Workingpapers/PDF/2024/cpp20240617 .pdf . services prices, with the market rent measure typically leading the PCE measure by one year .6 This relationship is particularly evident in the periods following the Great Recession and the COvID-19 pandemic . For example, PCE housing services infl ation reached'
 '8 PAR T 1: R ECENT E CONOMIC AND F INANCIAL D E v ELOPMENTS year ahead. (The box “Housing Services Inflation and Market Rent Measures” provides further details.) . . . while core nonhousing services price inflation flattened out so far this year Finally, price inflation for core nonhousing services—a broad group that includes services such as travel and dining, financial services, and car repair—slowed last year but flattened out, on net, in the first five months of this year. Core nonhousing services prices rose 3.4 percent in the 12 months ending in May, down from 4.7 percent a year ago but little changed since the end of last year (as shown in figure 3, right panel). The lack of further progress this year is due in large part to price increases in volatile categories—for example, portfolio management services, which can be influenced by idiosyncratic factors, such as swings in the'
 'periods following the Great Recession and the COvID-19 pandemic . For example, PCE housing services infl ation reached a peak of 8 .3 percent in April 2023, exactly one year after the 12-month change for the CoreLogic index reached its peak of 13 .8 percent . Since mid-2022, each of these measures of market rents has decelerated and returned to a growth rate similar to or below its average pre-pandemic pace . 7 While the PCE price index for housing services also began decelerating in mid-2023, its current rate of increase remains well above the average rate seen in the years before the pandemic . As noted earlier, changes in the PCE price index for housing services tend to lag changes in market rents because rental 6 . Several studies use market rent measures to predict housing services infl ation . See, for instance, Marijn A . Bolhuis, Judd N .L . Cramer, and Lawrence H . Summers']",Housing services inflation declined from over 8 percent in May 2023 to 5.5 percent in May 2024 but remains elevated above pre-pandemic levels.,How has housing services inflation changed since May 2023?,"['reasons for producing below capacity, which had increased considerably during the pandemic, have continued to fall and are now near pre- pandemic levels (figure 7). Housing services price inflation continued to slow gradually but remains elevated . . . The 12-month change in housing services prices moved down from more than 8 percent in May 2023 to 5.5 percent in May of this year but is still well above its pre-pandemic level (as shown in figure 3, right panel). Market rent inflation, which measures increases in rents for new housing leases to new tenants, has fallen markedly since late 2022 to near pre-pandemic rates, and this slowdown points to continued easing of housing services inflation over the Insufficient supply of labor 0 10 20 30 40 50 Percent 202420232022202120202019 7. Reasons for operating below full capacity Quarterly Insufficient supply of materials NOTE: The series are', 'regarding the timing of this decline and whether market rent infl ation will, in fact, remain moderate . 8 . Between January 2020 and April 2024, the CoreLogic Single-Family Rent Index and the Zillow Observed Rent Index have increased 32 percent and 38 percent, respectively, while PCE prices for housing services have increased 23 percent . See Christopher D . Cotton (2024), “A Faster Convergence of Shelter Prices and Market Rent: Implications for Infl ation,” Current Policy Perspectives 2024-4 (Boston: Federal Reserve Bank of Boston, June), https://www .bostonfed .org/-/media/ Documents/Workingpapers/PDF/2024/cpp20240617 .pdf . services prices, with the market rent measure typically leading the PCE measure by one year .6 This relationship is particularly evident in the periods following the Great Recession and the COvID-19 pandemic . For example, PCE housing services infl ation reached', '8 PAR T 1: R ECENT E CONOMIC AND F INANCIAL D E v ELOPMENTS year ahead. (The box “Housing Services Inflation and Market Rent Measures” provides further details.) . . . while core nonhousing services price inflation flattened out so far this year Finally, price inflation for core nonhousing services—a broad group that includes services such as travel and dining, financial services, and car repair—slowed last year but flattened out, on net, in the first five months of this year. Core nonhousing services prices rose 3.4 percent in the 12 months ending in May, down from 4.7 percent a year ago but little changed since the end of last year (as shown in figure 3, right panel). The lack of further progress this year is due in large part to price increases in volatile categories—for example, portfolio management services, which can be influenced by idiosyncratic factors, such as swings in the', 'periods following the Great Recession and the COvID-19 pandemic . For example, PCE housing services infl ation reached a peak of 8 .3 percent in April 2023, exactly one year after the 12-month change for the CoreLogic index reached its peak of 13 .8 percent . Since mid-2022, each of these measures of market rents has decelerated and returned to a growth rate similar to or below its average pre-pandemic pace . 7 While the PCE price index for housing services also began decelerating in mid-2023, its current rate of increase remains well above the average rate seen in the years before the pandemic . As noted earlier, changes in the PCE price index for housing services tend to lag changes in market rents because rental 6 . Several studies use market rent measures to predict housing services infl ation . See, for instance, Marijn A . Bolhuis, Judd N .L . Cramer, and Lawrence H . Summers']","Housing services price inflation has slowed gradually since May 2023, with the 12-month change in housing services prices moving down from more than 8 percent in May 2023 to 5.5 percent in May of this year, though it remains well above its pre-pandemic level.",Housing services inflation declined from over 8 percent in May 2023 to 5.5 percent in May 2024 but remains elevated above pre-pandemic levels.,1.0,0.9881166745520369,0.9166666666361111,1.0
What explains the lag between market rent inflation and PCE housing services inflation?,"The lag between market rent inflation and PCE housing services inflation is explained by the fact that the PCE price index for housing services measures average rent for all tenants—both new and existing—so its changes are more subdued and tend to lag changes in rent measures for new leases. Rental agreements typically update less frequently, causing the PCE measure to respond more slowly to changes in market rents.","['regarding the timing of this decline and whether market rent infl ation will, in fact, remain moderate . 8 . Between January 2020 and April 2024, the CoreLogic Single-Family Rent Index and the Zillow Observed Rent Index have increased 32 percent and 38 percent, respectively, while PCE prices for housing services have increased 23 percent . See Christopher D . Cotton (2024), “A Faster Convergence of Shelter Prices and Market Rent: Implications for Infl ation,” Current Policy Perspectives 2024-4 (Boston: Federal Reserve Bank of Boston, June), https://www .bostonfed .org/-/media/ Documents/Workingpapers/PDF/2024/cpp20240617 .pdf . services prices, with the market rent measure typically leading the PCE measure by one year .6 This relationship is particularly evident in the periods following the Great Recession and the COvID-19 pandemic . For example, PCE housing services infl ation reached'
 'periods following the Great Recession and the COvID-19 pandemic . For example, PCE housing services infl ation reached a peak of 8 .3 percent in April 2023, exactly one year after the 12-month change for the CoreLogic index reached its peak of 13 .8 percent . Since mid-2022, each of these measures of market rents has decelerated and returned to a growth rate similar to or below its average pre-pandemic pace . 7 While the PCE price index for housing services also began decelerating in mid-2023, its current rate of increase remains well above the average rate seen in the years before the pandemic . As noted earlier, changes in the PCE price index for housing services tend to lag changes in market rents because rental 6 . Several studies use market rent measures to predict housing services infl ation . See, for instance, Marijn A . Bolhuis, Judd N .L . Cramer, and Lawrence H . Summers'
 'and Randal verbrugge (2024), “Disentangling Rent Index Differences: Data, Methods, and Scope,” American Economic Review: Insights, vol . 6 (June), pp . 230–45 . The price index for housing services includes rents explicitly paid by renters as well as implicit rents that homeowners would have to pay if they were renting their homes known as owners’ equivalent rent (OER) . This index is an important component of the price index for personal consumption expenditures (PCE), composing about 15 .5 percent of the total PCE price index . Housing services prices started accelerating in 2021, and, as fi gure A illustrates, the contribution of these prices to the 12-month change in the core PCE price index increased notably, reaching a peak of 1 .4 percentage points in 2023 . In May 2024, the contribution of this component stood at 1 .0 percentage point, down from its peak but still well above the'
 '2024, the contribution of this component stood at 1 .0 percentage point, down from its peak but still well above the 0 .5 percentage point that was typical before the COvID-19 pandemic . The PCE price index for housing services is derived from two components of the consumer price index (CPI): rent of primary residence and OER . 1 The rent of primary residence index measures the average rent paid by tenants . OER estimates the rent that homeowners would pay if they were renting their homes without furnishings or utilities and is derived from rental data for units in the same neighborhood, with an adjustment for structure type . 2 Because the price index for housing services measures average rent for all tenants—both new tenants and existing tenants—its changes are more subdued and tend to lag changes in rent measures for new leases, described later . Because rental agreements typically']","Because PCE housing services inflation reflects average rents for all tenants, including existing leases that adjust slowly compared with new leases.",What explains the lag between market rent inflation and PCE housing services inflation?,"['regarding the timing of this decline and whether market rent infl ation will, in fact, remain moderate . 8 . Between January 2020 and April 2024, the CoreLogic Single-Family Rent Index and the Zillow Observed Rent Index have increased 32 percent and 38 percent, respectively, while PCE prices for housing services have increased 23 percent . See Christopher D . Cotton (2024), “A Faster Convergence of Shelter Prices and Market Rent: Implications for Infl ation,” Current Policy Perspectives 2024-4 (Boston: Federal Reserve Bank of Boston, June), https://www .bostonfed .org/-/media/ Documents/Workingpapers/PDF/2024/cpp20240617 .pdf . services prices, with the market rent measure typically leading the PCE measure by one year .6 This relationship is particularly evident in the periods following the Great Recession and the COvID-19 pandemic . For example, PCE housing services infl ation reached', 'periods following the Great Recession and the COvID-19 pandemic . For example, PCE housing services infl ation reached a peak of 8 .3 percent in April 2023, exactly one year after the 12-month change for the CoreLogic index reached its peak of 13 .8 percent . Since mid-2022, each of these measures of market rents has decelerated and returned to a growth rate similar to or below its average pre-pandemic pace . 7 While the PCE price index for housing services also began decelerating in mid-2023, its current rate of increase remains well above the average rate seen in the years before the pandemic . As noted earlier, changes in the PCE price index for housing services tend to lag changes in market rents because rental 6 . Several studies use market rent measures to predict housing services infl ation . See, for instance, Marijn A . Bolhuis, Judd N .L . Cramer, and Lawrence H . Summers', 'and Randal verbrugge (2024), “Disentangling Rent Index Differences: Data, Methods, and Scope,” American Economic Review: Insights, vol . 6 (June), pp . 230–45 . The price index for housing services includes rents explicitly paid by renters as well as implicit rents that homeowners would have to pay if they were renting their homes known as owners’ equivalent rent (OER) . This index is an important component of the price index for personal consumption expenditures (PCE), composing about 15 .5 percent of the total PCE price index . Housing services prices started accelerating in 2021, and, as fi gure A illustrates, the contribution of these prices to the 12-month change in the core PCE price index increased notably, reaching a peak of 1 .4 percentage points in 2023 . In May 2024, the contribution of this component stood at 1 .0 percentage point, down from its peak but still well above the', '2024, the contribution of this component stood at 1 .0 percentage point, down from its peak but still well above the 0 .5 percentage point that was typical before the COvID-19 pandemic . The PCE price index for housing services is derived from two components of the consumer price index (CPI): rent of primary residence and OER . 1 The rent of primary residence index measures the average rent paid by tenants . OER estimates the rent that homeowners would pay if they were renting their homes without furnishings or utilities and is derived from rental data for units in the same neighborhood, with an adjustment for structure type . 2 Because the price index for housing services measures average rent for all tenants—both new tenants and existing tenants—its changes are more subdued and tend to lag changes in rent measures for new leases, described later . Because rental agreements typically']","The lag between market rent inflation and PCE housing services inflation is explained by the fact that the PCE price index for housing services measures average rent for all tenants—both new and existing—so its changes are more subdued and tend to lag changes in rent measures for new leases. Rental agreements typically update less frequently, causing the PCE measure to respond more slowly to changes in market rents.","Because PCE housing services inflation reflects average rents for all tenants, including existing leases that adjust slowly compared with new leases.",0.6666666666666666,1.0000000000000002,0.999999999975,0.0
What has happened to longer-term inflation expectations over the past year?,"Longer-term inflation expectations have generally been moving sideways over the past year, within the range seen during the decade before the pandemic, and appear broadly consistent with the FOMC’s longer-run 2 percent inflation objective.","['example, portfolio management services, which can be influenced by idiosyncratic factors, such as swings in the stock market, more than supply and demand conditions. Because labor is a significant input to these service sectors, the ongoing deceleration in labor costs—supported by softening labor demand and improvements in labor supply—suggests that disinflation will eventually resume for this category. Measures of longer-term inflation expectations have been stable; shorter- term expectations have been volatile but are generally lower than a year earlier The generally held view among economists and policymakers is that inflation expectations influence actual inflation by affecting wage- and price-setting decisions. Survey-based measures of expected inflation over a longer horizon have generally been moving sideways over the past year, within the range seen during the decade before the'
 '12 PAR T 1: R ECENT E CONOMIC AND F INANCIAL D E v ELOPMENTS Forecasters, conducted by the Federal Reserve Bank of Philadelphia, continued to expect PCE price inflation to average 2 percent over the five years beginning five years from now. Inflation expectations over a shorter horizon— which tend to follow observed inflation more closely and tend to be more volatile—have moved down, on net, since the middle of 2022 to near the range seen during the decade before the pandemic. In recent months, the median value for inflation expectations over the next year as measured in the Michigan survey has been generally lower than readings from a year earlier. Similarly, expected inflation for the next year as measured in the Survey of Consumer Expectations, conducted by the Federal Reserve Bank of New Y ork, has also declined, on average, from a year earlier. Market-based measures of longer-term'
 'been broad based, with over 60 percent of industries expanding their employment, on net, over the three months ending in May. That said, gains have been particularly strong in health care and in state and local governments, where employment remains below the levels implied by pre-pandemic trends. 2 2. Administr ative data from the Quarterly Census of Employment and Wages (QCEW) suggest that job growth last year was solid, but not as strong as reported in the Current Employment Statistics (CES). The CES 5-year 0 .5 1.0 1.5 2.0 2.5 3.0 3.5 4.0 Percent 2024 2023 2022 2021 2020 2019 2018 2017 2016 9. Inflation compensation implied by Treasury Inflation-Protected Securities Daily 5-to-10-year NOTE:T he data are at a business-day frequency and are estimated from smoothed nominal and inflation-indexed Treasury yield curves. SOURCE: Federal Reserve Bank of New York; Federal Reserve Board staff'
 'horizon have generally been moving sideways over the past year, within the range seen during the decade before the pandemic, and they appear broadly consistent with the FOMC’s longer-run 2 percent inflation objective. This development is seen for surveys of households, such as the University of Michigan Surveys of Consumers, and for surveys of professional forecasters (figure 8). For example, the median forecaster in the Survey of Professional SPF, next 10 years Michigan survey, next 5 to 10 years SPF, 6 to 10 years ahead 1.5 2.0 2.5 3.0 3.5 4.0 4.5 5.0 5.5 6.0 6.5 Percent 20242022202020182016201420122010 8. Measures of inflation expectations NOTE: The data for the Michigan survey are monthly and extend through June 2024. The Survey of Professional Forecasters (SPF) data are quarterly and extend through 2024:Q2. SOURCE: University of Michigan Surveys of Consumers; Federal Reserve Bank']",Longer-term inflation expectations have remained stable and consistent with the Federal Reserve’s 2 percent inflation objective.,What has happened to longer-term inflation expectations over the past year?,"['example, portfolio management services, which can be influenced by idiosyncratic factors, such as swings in the stock market, more than supply and demand conditions. Because labor is a significant input to these service sectors, the ongoing deceleration in labor costs—supported by softening labor demand and improvements in labor supply—suggests that disinflation will eventually resume for this category. Measures of longer-term inflation expectations have been stable; shorter- term expectations have been volatile but are generally lower than a year earlier The generally held view among economists and policymakers is that inflation expectations influence actual inflation by affecting wage- and price-setting decisions. Survey-based measures of expected inflation over a longer horizon have generally been moving sideways over the past year, within the range seen during the decade before the', '12 PAR T 1: R ECENT E CONOMIC AND F INANCIAL D E v ELOPMENTS Forecasters, conducted by the Federal Reserve Bank of Philadelphia, continued to expect PCE price inflation to average 2 percent over the five years beginning five years from now. Inflation expectations over a shorter horizon— which tend to follow observed inflation more closely and tend to be more volatile—have moved down, on net, since the middle of 2022 to near the range seen during the decade before the pandemic. In recent months, the median value for inflation expectations over the next year as measured in the Michigan survey has been generally lower than readings from a year earlier. Similarly, expected inflation for the next year as measured in the Survey of Consumer Expectations, conducted by the Federal Reserve Bank of New Y ork, has also declined, on average, from a year earlier. Market-based measures of longer-term', 'been broad based, with over 60 percent of industries expanding their employment, on net, over the three months ending in May. That said, gains have been particularly strong in health care and in state and local governments, where employment remains below the levels implied by pre-pandemic trends. 2 2. Administr ative data from the Quarterly Census of Employment and Wages (QCEW) suggest that job growth last year was solid, but not as strong as reported in the Current Employment Statistics (CES). The CES 5-year 0 .5 1.0 1.5 2.0 2.5 3.0 3.5 4.0 Percent 2024 2023 2022 2021 2020 2019 2018 2017 2016 9. Inflation compensation implied by Treasury Inflation-Protected Securities Daily 5-to-10-year NOTE:T he data are at a business-day frequency and are estimated from smoothed nominal and inflation-indexed Treasury yield curves. SOURCE: Federal Reserve Bank of New York; Federal Reserve Board staff', 'horizon have generally been moving sideways over the past year, within the range seen during the decade before the pandemic, and they appear broadly consistent with the FOMC’s longer-run 2 percent inflation objective. This development is seen for surveys of households, such as the University of Michigan Surveys of Consumers, and for surveys of professional forecasters (figure 8). For example, the median forecaster in the Survey of Professional SPF, next 10 years Michigan survey, next 5 to 10 years SPF, 6 to 10 years ahead 1.5 2.0 2.5 3.0 3.5 4.0 4.5 5.0 5.5 6.0 6.5 Percent 20242022202020182016201420122010 8. Measures of inflation expectations NOTE: The data for the Michigan survey are monthly and extend through June 2024. The Survey of Professional Forecasters (SPF) data are quarterly and extend through 2024:Q2. SOURCE: University of Michigan Surveys of Consumers; Federal Reserve Bank']","Longer-term inflation expectations have generally been moving sideways over the past year, within the range seen during the decade before the pandemic, and appear broadly consistent with the FOMC’s longer-run 2 percent inflation objective.",Longer-term inflation expectations have remained stable and consistent with the Federal Reserve’s 2 percent inflation objective.,1.0,0.9726603333057502,0.7499999999625,1.0
How has the labor market changed so far in 2024?,"In the first half of 2024, labor demand has gradually cooled from its previously elevated levels, with job openings continuing to fall from their all-time high in March 2022. The unemployment rate edged up but remained at a historically low level of 4.0 percent in May. Labor supply has increased further, supported by strong population growth due to high levels of immigration. Overall, the labor market has become less tight but remains strong, with conditions similar to those immediately before the pandemic.","['than 55 exhibiting no signs of recovery. (The box “Employment and Earnings across Demographic Groups” provides further details.) Labor supply has also been boosted in recent years by relatively strong population growth due to a notable expansion in immigration. Though official estimates by the Census Bureau show a robust increase in population growth in 2022 and 2023, recent estimates by the Congressional Budget Office indicate that actual population growth may have been considerably higher. The most recent data suggest that immigration is somewhat slower than the strong rates seen late last year. 5 . . . resulting in a normalization of labor market conditions With cooling labor demand and rising labor supply, the labor market became gradually less tight over the first half of this year, although it nevertheless remains strong. The balance between demand and supply in the labor market'
 'MONETARy POLIC y REPORT: JULy 2024 13 The unemployment rate has edged up since the middle of 2023 but was still at a historically low level of 4.0 percent in May. Through May, the unemployment rate has remained at or below 4 percent for over two years (figure 11). Unemployment rates among most age, educational attainment, sex, and ethnic and racial groups remain near their respective historical lows (figure 12). Labor demand has been gradually cooling . . . Demand for labor remained strong in the first half of 2024 but has continued to cool gradually, on net, from its very elevated levels of early 2022. Job openings, as measured in the Job Openings and Labor Turnover Survey (JOLTS), have continued to fall from their all- time high recorded in March 2022 but are payroll data will be revised in early 2025, when the Bureau of Labor Statistics benchmarks these data to employment counts from'
 'half of this year, although it nevertheless remains strong. The balance between demand and supply in the labor market appears similar to that during the period immediately before the pandemic. 5. A r ecent report from the Congressional Budget Office (CBO) estimates that immigration in 2022 and 2023 was considerably higher than in the Census Bureau’s estimates. See Congressional Budget Office (2024), The Demographic Outlook: 2024 to 2054 (Washington: CBO, January), https://www.cbo.gov/publication/59697. Recent studies have put more weight on the CBO estimates, in part because the Census Bureau is using lagged estimates of immigration from the American Community Survey, while the CBO is using more recent, high-frequency data. See Wendy Edelberg and Tara Watson (2024), “New Immigration Estimates Help Make Sense of the Pace of Employment,” Hamilton Project (Washington: Brookings'
 'of layoffs, such as initial claims for unemployment insurance and the rate of layoffs and discharges in the JOLTS report, have remained at historically low levels. . . . and labor supply has increased further . . . Meanwhile, the supply of labor has continued to increase on net. While labor force participation has leveled off over the past year, the U.S. population increased strongly because of high levels of immigration. The labor force participation rate (LFPR)— which measures the share of people either working or actively seeking work—increased solidly from the beginning of 2021 through the middle of 2023 but appears to have 3. Some ana lysts have noted that the vacancy-posting behavior of firms may have changed since 2019 in ways that lift the number of vacancies. For example, multi- establishment firms may be posting vacancies for a single job opening at several or all of its']","The labor market remains strong, with solid job gains, low unemployment around 4 percent, and gradually cooling labor demand.",How has the labor market changed so far in 2024?,"['than 55 exhibiting no signs of recovery. (The box “Employment and Earnings across Demographic Groups” provides further details.) Labor supply has also been boosted in recent years by relatively strong population growth due to a notable expansion in immigration. Though official estimates by the Census Bureau show a robust increase in population growth in 2022 and 2023, recent estimates by the Congressional Budget Office indicate that actual population growth may have been considerably higher. The most recent data suggest that immigration is somewhat slower than the strong rates seen late last year. 5 . . . resulting in a normalization of labor market conditions With cooling labor demand and rising labor supply, the labor market became gradually less tight over the first half of this year, although it nevertheless remains strong. The balance between demand and supply in the labor market', 'MONETARy POLIC y REPORT: JULy 2024 13 The unemployment rate has edged up since the middle of 2023 but was still at a historically low level of 4.0 percent in May. Through May, the unemployment rate has remained at or below 4 percent for over two years (figure 11). Unemployment rates among most age, educational attainment, sex, and ethnic and racial groups remain near their respective historical lows (figure 12). Labor demand has been gradually cooling . . . Demand for labor remained strong in the first half of 2024 but has continued to cool gradually, on net, from its very elevated levels of early 2022. Job openings, as measured in the Job Openings and Labor Turnover Survey (JOLTS), have continued to fall from their all- time high recorded in March 2022 but are payroll data will be revised in early 2025, when the Bureau of Labor Statistics benchmarks these data to employment counts from', 'half of this year, although it nevertheless remains strong. The balance between demand and supply in the labor market appears similar to that during the period immediately before the pandemic. 5. A r ecent report from the Congressional Budget Office (CBO) estimates that immigration in 2022 and 2023 was considerably higher than in the Census Bureau’s estimates. See Congressional Budget Office (2024), The Demographic Outlook: 2024 to 2054 (Washington: CBO, January), https://www.cbo.gov/publication/59697. Recent studies have put more weight on the CBO estimates, in part because the Census Bureau is using lagged estimates of immigration from the American Community Survey, while the CBO is using more recent, high-frequency data. See Wendy Edelberg and Tara Watson (2024), “New Immigration Estimates Help Make Sense of the Pace of Employment,” Hamilton Project (Washington: Brookings', 'of layoffs, such as initial claims for unemployment insurance and the rate of layoffs and discharges in the JOLTS report, have remained at historically low levels. . . . and labor supply has increased further . . . Meanwhile, the supply of labor has continued to increase on net. While labor force participation has leveled off over the past year, the U.S. population increased strongly because of high levels of immigration. The labor force participation rate (LFPR)— which measures the share of people either working or actively seeking work—increased solidly from the beginning of 2021 through the middle of 2023 but appears to have 3. Some ana lysts have noted that the vacancy-posting behavior of firms may have changed since 2019 in ways that lift the number of vacancies. For example, multi- establishment firms may be posting vacancies for a single job opening at several or all of its']","In the first half of 2024, labor demand has gradually cooled from its previously elevated levels, with job openings continuing to fall from their all-time high in March 2022. The unemployment rate edged up but remained at a historically low level of 4.0 percent in May. Labor supply has increased further, supported by strong population growth due to high levels of immigration. Overall, the labor market has become less tight but remains strong, with conditions similar to those immediately before the pandemic.","The labor market remains strong, with solid job gains, low unemployment around 4 percent, and gradually cooling labor demand.",1.0,0.9128196590632548,0.999999999975,1.0
What factors contributed to the moderation in GDP growth in the first quarter of 2024?,"The moderation in GDP growth in the first quarter of 2024 was due in large part to sizable drags from net exports and inventory investment, which are categories of expenditures that tend to be volatile.","['22 PAR T 1: R ECENT E CONOMIC AND F INANCIAL D E v ELOPMENTS and robotics, as well as the high rate of new business formation brought about by the pandemic, could boost productivity growth above that pace in coming years. Growth in gross domestic product moderated in the first quarter, but private domestic demand remained solid After expanding at a robust pace in the second half of last year despite restrictive financial conditions, real gross domestic product (GDP) decelerated to a moderate annual growth rate of 1.4 percent in the first quarter of this year (figure 17). The step-down was due in large part to sizable drags from net exports and inventory investment; these categories of expenditures tend to be volatile even in normal times and have been even more so since the pandemic. Growth in private domestic final purchases—that is, consumer spending, business fixed investment, and'
 'MONETARy POLIC y REPORT: JULy 2024 23 After having returned to pre-pandemic levels in late 2021, manufacturing output has been little changed, on net, since then. While motor vehicle production has continued to rebound from earlier disruptions, factory production outside of motor vehicles has drifted down somewhat. The diffusion indexes of new orders from various national and regional surveys of manufacturers remained mostly soft in June, suggesting continued modest weakness in coming months. Consumer spending growth has been resilient but eased this year Consumer spending adjusted for inflation grew at a solid rate of 2.7 percent in 2023 but slowed in the first quarter to a moderate 1.5 percent pace (figure 18). The resilience in consumer spending last year in the face of high interest rates likely reflected strong job gains and rising real wages. Indeed, real disposable personal income'
 '28 PAR T 1: R ECENT E CONOMIC AND F INANCIAL D E v ELOPMENTS last year, real imports of goods and services have stepped up further this year despite some deceleration in U.S. GDP growth. By contrast, real export growth has slowed significantly, as some categories with especially strong growth in the second half of last year declined this year, particularly industrial supplies and materials (figure 28). The current account deficit as a share of GDP widened slightly in the first quarter of 2024 and remains wider than before the pandemic. Federal fiscal policy actions were roughly neutral for GDP growth last year and so far this year Federal purchases grew modestly in 2023 and moved sideways in the first quarter of the year. The overall contribution of discretionary federal fiscal policy to real GDP growth appears to have been roughly neutral last year and in the first quarter of this year,'
 'in over two decades. The primary deficit—the difference between noninterest outlays and receipts—has moved down, on net, since fiscal 2020 and moved sideways in 2022 to 2023, as the effects of a decline in noninterest outlays as a share of GDP were offset by a decline in receipts as a share of GDP . As a result of the unprecedented fiscal support enacted early in the pandemic, federal debt held by the public jumped roughly 20 percentage Expenditures 14 16 18 20 22 24 26 28 30 32 Percent of nominal GDP 2024 2021 2018 2015 2012 2009 2006 2003 2000 1997 Annual 29. Federal receipts and expenditures Receipts NOTE: Through 2023, the receipts and expenditures data are on a unified-budget basis and are for fiscal years (October to September); gross domestic product (GDP) is for the 4 quarters ending in Q3. For 2024, receipts and expenditures are for the 12 months ending in May; GDP is the']",GDP growth slowed mainly because of drags from net exports and inventory investment.,What factors contributed to the moderation in GDP growth in the first quarter of 2024?,"['22 PAR T 1: R ECENT E CONOMIC AND F INANCIAL D E v ELOPMENTS and robotics, as well as the high rate of new business formation brought about by the pandemic, could boost productivity growth above that pace in coming years. Growth in gross domestic product moderated in the first quarter, but private domestic demand remained solid After expanding at a robust pace in the second half of last year despite restrictive financial conditions, real gross domestic product (GDP) decelerated to a moderate annual growth rate of 1.4 percent in the first quarter of this year (figure 17). The step-down was due in large part to sizable drags from net exports and inventory investment; these categories of expenditures tend to be volatile even in normal times and have been even more so since the pandemic. Growth in private domestic final purchases—that is, consumer spending, business fixed investment, and', 'MONETARy POLIC y REPORT: JULy 2024 23 After having returned to pre-pandemic levels in late 2021, manufacturing output has been little changed, on net, since then. While motor vehicle production has continued to rebound from earlier disruptions, factory production outside of motor vehicles has drifted down somewhat. The diffusion indexes of new orders from various national and regional surveys of manufacturers remained mostly soft in June, suggesting continued modest weakness in coming months. Consumer spending growth has been resilient but eased this year Consumer spending adjusted for inflation grew at a solid rate of 2.7 percent in 2023 but slowed in the first quarter to a moderate 1.5 percent pace (figure 18). The resilience in consumer spending last year in the face of high interest rates likely reflected strong job gains and rising real wages. Indeed, real disposable personal income', '28 PAR T 1: R ECENT E CONOMIC AND F INANCIAL D E v ELOPMENTS last year, real imports of goods and services have stepped up further this year despite some deceleration in U.S. GDP growth. By contrast, real export growth has slowed significantly, as some categories with especially strong growth in the second half of last year declined this year, particularly industrial supplies and materials (figure 28). The current account deficit as a share of GDP widened slightly in the first quarter of 2024 and remains wider than before the pandemic. Federal fiscal policy actions were roughly neutral for GDP growth last year and so far this year Federal purchases grew modestly in 2023 and moved sideways in the first quarter of the year. The overall contribution of discretionary federal fiscal policy to real GDP growth appears to have been roughly neutral last year and in the first quarter of this year,', 'in over two decades. The primary deficit—the difference between noninterest outlays and receipts—has moved down, on net, since fiscal 2020 and moved sideways in 2022 to 2023, as the effects of a decline in noninterest outlays as a share of GDP were offset by a decline in receipts as a share of GDP . As a result of the unprecedented fiscal support enacted early in the pandemic, federal debt held by the public jumped roughly 20 percentage Expenditures 14 16 18 20 22 24 26 28 30 32 Percent of nominal GDP 2024 2021 2018 2015 2012 2009 2006 2003 2000 1997 Annual 29. Federal receipts and expenditures Receipts NOTE: Through 2023, the receipts and expenditures data are on a unified-budget basis and are for fiscal years (October to September); gross domestic product (GDP) is for the 4 quarters ending in Q3. For 2024, receipts and expenditures are for the 12 months ending in May; GDP is the']","The moderation in GDP growth in the first quarter of 2024 was due in large part to sizable drags from net exports and inventory investment, which are categories of expenditures that tend to be volatile.",GDP growth slowed mainly because of drags from net exports and inventory investment.,1.0,0.9747676798218622,0.8333333332916666,1.0
What is the Federal Reserve’s current stance on interest rates?,"The Federal Reserve’s current stance on interest rates is that the expected level of the federal funds rate over the next few years is higher since the beginning of the year. Market-implied prices suggest investors expect the federal funds rate to decline to about 4.9 percent by year-end 2024 and 4.0 percent by year-end 2025, but these expectations have been revised upward compared to the end of last year. Most simple monetary policy rules now call for levels of the federal funds rate that are close to or below the current target range.","['declined. (See the box “Developments in the Federal Reserve’s Balance Sheet and Money Markets” in Part 2.) Monetary policy rules. Simple monetary policy rules, which prescribe a setting for the policy interest rate in response to the behavior of a small number of economic variables, can provide useful guidance to policymakers. With inflation easing over the past year, the policy rate prescriptions of most simple monetary policy rules have decreased recently and now call for levels of the federal funds rate that are close to or below the current target range for the federal funds rate. (See the box “Monetary Policy Rules in the Current Environment” in Part 2.)'
 'federal funds rate to decline to about 4.9 percent and 4.0 percent by year-ends 2024 and 2025, respectively. Roughly consistent with market-implied measures, respondents to the Blue Chip Financial Forecasts survey have significantly revised upward their expectations for the path of the federal funds rate, with the average respondent in the July survey expecting the federal funds rate to decline to 5.0 percent in the fourth quarter of 2024— 0.6 percentage point higher than anticipated at the end of last year. Yields on U.S. nominal Treasury securities are higher on net Consistent with the upward revision in the market-implied federal funds rate path, yields on shorter-term Treasury securities rose notably between mid-February and late April before retracing some of the increase afterward. Yields on longer-term nominal Treasury securities moved similarly with yields on shorter-term'
 '30 PAR T 1: R ECENT E CONOMIC AND F INANCIAL D E v ELOPMENTS Financial Developments The expected level of the federal funds rate over the next few years is higher since the beginning of the year Over the late winter and early spring, the market-implied federal funds rate path moved up, boosted by above-expectations inflation data that prompted market participants to reassess the monetary policy restraint required to return inflation to 2 percent. The rise in the path was partially reversed since late April amid mixed but generally softer-than- expected data on real activity and inflation. Since the beginning of the year, on net, the market-implied federal funds rate path rose substantially (figure 33). Financial market prices currently suggest that investors expect the federal funds rate to decline to about 4.9 percent and 4.0 percent by year-ends 2024 and 2025, respectively. Roughly'
 'the increase afterward. Yields on longer-term nominal Treasury securities moved similarly with yields on shorter-term nominal Treasury securities. On balance, nominal Treasury yields are moderately higher than at the beginning of the year across the maturity spectrum (figure 34). An increase in real yields—as measured by yields on Treasury Inflation-Protected Securities—accounted for a large portion of the rise in nominal Treasury yields, especially at longer maturities. December 29, 2023 2.5 3.0 3.5 4.0 4.5 5.0 5.5 Percent 202820272026202520242023 33. Market-implied federal funds rate path Quarterly June 28, 2024 NOTE: The federal funds rate path is implied by quotes on overnight index swaps—a derivative contract tied to the effective federal funds rate. The implied path as of December 29, 2023, is compared with that as of June 28, 2024. The path is e stimated with a spline approach,']","The Federal Reserve has maintained a restrictive policy stance, holding the federal funds rate at 5¼ to 5½ percent.",What is the Federal Reserve’s current stance on interest rates?,"['declined. (See the box “Developments in the Federal Reserve’s Balance Sheet and Money Markets” in Part 2.) Monetary policy rules. Simple monetary policy rules, which prescribe a setting for the policy interest rate in response to the behavior of a small number of economic variables, can provide useful guidance to policymakers. With inflation easing over the past year, the policy rate prescriptions of most simple monetary policy rules have decreased recently and now call for levels of the federal funds rate that are close to or below the current target range for the federal funds rate. (See the box “Monetary Policy Rules in the Current Environment” in Part 2.)', 'federal funds rate to decline to about 4.9 percent and 4.0 percent by year-ends 2024 and 2025, respectively. Roughly consistent with market-implied measures, respondents to the Blue Chip Financial Forecasts survey have significantly revised upward their expectations for the path of the federal funds rate, with the average respondent in the July survey expecting the federal funds rate to decline to 5.0 percent in the fourth quarter of 2024— 0.6 percentage point higher than anticipated at the end of last year. Yields on U.S. nominal Treasury securities are higher on net Consistent with the upward revision in the market-implied federal funds rate path, yields on shorter-term Treasury securities rose notably between mid-February and late April before retracing some of the increase afterward. Yields on longer-term nominal Treasury securities moved similarly with yields on shorter-term', '30 PAR T 1: R ECENT E CONOMIC AND F INANCIAL D E v ELOPMENTS Financial Developments The expected level of the federal funds rate over the next few years is higher since the beginning of the year Over the late winter and early spring, the market-implied federal funds rate path moved up, boosted by above-expectations inflation data that prompted market participants to reassess the monetary policy restraint required to return inflation to 2 percent. The rise in the path was partially reversed since late April amid mixed but generally softer-than- expected data on real activity and inflation. Since the beginning of the year, on net, the market-implied federal funds rate path rose substantially (figure 33). Financial market prices currently suggest that investors expect the federal funds rate to decline to about 4.9 percent and 4.0 percent by year-ends 2024 and 2025, respectively. Roughly', 'the increase afterward. Yields on longer-term nominal Treasury securities moved similarly with yields on shorter-term nominal Treasury securities. On balance, nominal Treasury yields are moderately higher than at the beginning of the year across the maturity spectrum (figure 34). An increase in real yields—as measured by yields on Treasury Inflation-Protected Securities—accounted for a large portion of the rise in nominal Treasury yields, especially at longer maturities. December 29, 2023 2.5 3.0 3.5 4.0 4.5 5.0 5.5 Percent 202820272026202520242023 33. Market-implied federal funds rate path Quarterly June 28, 2024 NOTE: The federal funds rate path is implied by quotes on overnight index swaps—a derivative contract tied to the effective federal funds rate. The implied path as of December 29, 2023, is compared with that as of June 28, 2024. The path is e stimated with a spline approach,']","The Federal Reserve’s current stance on interest rates is that the expected level of the federal funds rate over the next few years is higher since the beginning of the year. Market-implied prices suggest investors expect the federal funds rate to decline to about 4.9 percent by year-end 2024 and 4.0 percent by year-end 2025, but these expectations have been revised upward compared to the end of last year. Most simple monetary policy rules now call for levels of the federal funds rate that are close to or below the current target range.","The Federal Reserve has maintained a restrictive policy stance, holding the federal funds rate at 5¼ to 5½ percent.",1.0,0.9575346274252006,0.3333333333,0.0
